<?xml version="1.0" encoding="Windows-1252"?>
<xs:schema xmlns="http://tempuri.org/rutas" elementFormDefault="qualified" targetNamespace="http://tempuri.org/rutas" xmlns:xs="http://www.w3.org/2001/XMLSchema">
	<xs:element name="rutas">
		<xs:complexType>
			<xs:sequence>
				<xs:element minOccurs="3" maxOccurs="unbounded" ref="ruta" />
			</xs:sequence>
		</xs:complexType>
	</xs:element>
	<xs:element name="ruta">
		<xs:complexType>
			<xs:sequence>
				<xs:element ref="datos" />
				<xs:element ref="hitos" />
			</xs:sequence>
			<xs:attribute name="nombreRuta" type="xs:ID" use="required" />
		</xs:complexType>
	</xs:element>
	<xs:element name="datos">
		<xs:complexType>
			<xs:sequence>
				<xs:element ref="tipoRuta" />
				<xs:element ref="medioTransporte" />
				<xs:element minOccurs="0" maxOccurs="1" ref="fechaIni" />
				<xs:element minOccurs="0" maxOccurs="1" ref="horaIni" />
				<xs:element ref="duracion" />
				<xs:element ref="agencia" />
				<xs:element ref="descripcionRuta" />
				<xs:element ref="sugerencias" />
				<xs:element ref="lugar" />
				<xs:element ref="direccion" />
				<xs:element ref="coordenadasRuta" />
				<xs:element minOccurs="3" maxOccurs="unbounded" ref="referencia" />
				<xs:element ref="recomendacion" />
			</xs:sequence>
		</xs:complexType>
	</xs:element>
	<xs:element name="tipoRuta" type="xs:string" />
	<xs:element name="medioTransporte" type="xs:string" />
	<xs:element name="fechaIni" type="xs:string" />
	<xs:element name="horaIni" type="xs:string" />
	<xs:element name="duracion" type="xs:string" />
	<xs:element name="agencia" type="xs:string" />
	<xs:element name="descripcionRuta" type="xs:string" />
	<xs:element name="sugerencias" type="xs:string" />
	<xs:element name="lugar" type="xs:string" />
	<xs:element name="direccion" type="xs:string" />
	<xs:element name="referencia" type="xs:string" />

	<xs:element name="recomendacion">
		<xs:simpleType>
			<xs:restriction  base="xs:integer">
				<xs:minInclusive value="1"/>
				<xs:maxInclusive value="10"/>
			</xs:restriction>
		</xs:simpleType>
	</xs:element>
	
	<xs:element name="coordenadasRuta">
		<xs:complexType>
			<xs:sequence>
				<xs:element ref="longitud" />
				<xs:element ref="latitud" />
				<xs:element ref="altitud" />
			</xs:sequence>
		</xs:complexType>
	</xs:element>
	<xs:element name="hitos">
		<xs:complexType>
			<xs:sequence>
				<xs:element minOccurs="3" maxOccurs="unbounded" ref="hito" />
			</xs:sequence>
		</xs:complexType>
	</xs:element>
	<xs:element name="hito">
		<xs:complexType>
			<xs:sequence>
				<xs:element ref="descripcionHito" />
				<xs:element ref="coordenadasHito" />
				<xs:element ref="distancia" />
				<xs:element minOccurs="1" maxOccurs="5" ref="foto" />
				<xs:element minOccurs="0" maxOccurs="3" ref="video" />
			</xs:sequence>
			<xs:attribute name="nombreHito" type="xs:string" use="required" />
		</xs:complexType>
	</xs:element>
	<xs:element name="coordenadasHito">
		<xs:complexType>
			<xs:sequence>
				<xs:element ref="longitud" />
				<xs:element ref="latitud" />
				<xs:element ref="altitud" />
			</xs:sequence>
		</xs:complexType>
	</xs:element>
	<xs:element name="descripcionHito" type="xs:string" />
	<xs:element name="distancia" type="xs:string" />
	<xs:element name="foto" type="xs:string" />
	<xs:element name="video" type="xs:string" />
	<xs:element name="longitud" type="xs:decimal" />
	<xs:element name="latitud" type="xs:decimal" />
	<xs:element name="altitud" type="xs:decimal" />
</xs:schema>