<?xml version="1.0" encoding="UTF-8"?>
<rutas
xmlns="http://www.uniovi.es"
xmlns:xsi="http://www.w3.org/2001/XMLSchema-instance"
xsi:schemaLocation="http://www.uniovi.es rutas.xsd"
>
	<ruta nombreRuta="Amphitheatre Viewpoint – Tugela Gorge Recorrido circular desde Bonjaneni" > 
		<datos>
			<tipoRuta>Senderismo</tipoRuta>
			<medioTransporte>A pie</medioTransporte>
			<coordenadasRuta>
				<longitud>-28.7112194</longitud>
				<latitud>28.9335923</latitud>
				<altitud>18.08</altitud>
			</coordenadasRuta>
			<duracion>4 horas 38 minutos - 12,6 km</duracion>
			<agencia>Ninguna</agencia>
			<descripcionRuta>Caminata moderada. Se necesita buena forma física. 
				Sendas accesibles en su mayoría. Se requiere tener paso firme. 
				El punto de inicio de la Ruta está junto a un aparcamiento.</descripcionRuta>
			<sugerencias>Llevar agua</sugerencias>
			<lugar>Bonjaneni</lugar>
			<direccion>Thendele Camp, Royal Natal Park, Sudáfrica</direccion>
			<referencia>https://www.komoot.com/es-es/smarttour/109968</referencia>
			<referencia>https://es.wikipedia.org/wiki/Salto_del_Tugela</referencia>
			<referencia>https://en.wikipedia.org/wiki/Amphitheatre_(Drakensberg)</referencia>
			<recomendacion>9</recomendacion>
		</datos>
		<hitos>
			<hito nombreHito="Mushroomrock">
				<descripcionHito>Lugar favorito para senderismo</descripcionHito>
				<coordenadasHito>
					<longitud>-28.7112194</longitud>
					<latitud>28.9335923</latitud>
					<altitud>18.08</altitud>
				</coordenadasHito>
				<distancia>1960</distancia>
				<foto>Mushroomrock.png</foto>
			</hito>
			<hito nombreHito="Amphitheatre">
				<descripcionHito>Lugar favorito para senderismo</descripcionHito>
				<coordenadasHito>
					<longitud>-28.7594444</longitud>
					<latitud>28.8741134</latitud>
					<altitud>14</altitud>
				</coordenadasHito>
				<distancia>4000</distancia>
				<foto>Amphitheatre.jpg</foto>
			</hito>
			<hito nombreHito="Tugela Schlucht (George)">
				<descripcionHito>Lugar favorito para senderismo</descripcionHito>
				<coordenadasHito>
					<longitud>-28.7612577</longitud>
					<latitud>28.8870956</latitud>
					<altitud>13.75</altitud>
				</coordenadasHito>
				<distancia>6030</distancia>
				<foto>TugelaSchlucht.jpg</foto>
				<video>https://www.youtube.com/watch?v=tlZR29yV9K4</video>
			</hito>
		</hitos>
	</ruta>


	<ruta nombreRuta="Rock Pool – Black Pool Recorrido circular desde Ha Lehloara" > 
		<datos>
			<tipoRuta>Senderismo</tipoRuta>
			<medioTransporte>A pie</medioTransporte>
			<coordenadasRuta>
				<longitud>-28.9159641</longitud>
				<latitud>28.4234915</latitud>
				<altitud>14.5</altitud>
			</coordenadasRuta>
			<duracion>2 horas 43 minutos - 9,22 km</duracion>
			<agencia>Ninguna</agencia>
			<descripcionRuta>Caminata difícil. Se necesita muy buena forma física. Sendas de fácil acceso. Para todos los niveles.</descripcionRuta>
			<sugerencias>Llevar agua</sugerencias>
			<lugar>Hotel Maliba Lodge</lugar>
			<direccion>Hotel Maliba Lodge, Lesoto, Sudáfrica</direccion>
			<referencia>https://www.komoot.com/es-es/smarttour/19154415</referencia>
			<referencia>https://www.booking.com/Share-CsatN36</referencia>
			<referencia>https://maliba-lodge.com</referencia>
			<recomendacion>8</recomendacion>
		</datos>
		<hitos>
			<hito nombreHito="Hotel Maliba Lodge">
				<descripcionHito>Lugar favorito para senderismo</descripcionHito>
				<coordenadasHito>
					<longitud>-28.9159641</longitud>
					<latitud>28.4234915</latitud>
					<altitud>14.5</altitud>
				</coordenadasHito>
				<distancia>0</distancia>
				<foto>HotelMalibaLodge.jpg</foto>
			</hito>
			<hito nombreHito="Black Pool">
				<descripcionHito>Lugar favorito para senderismo</descripcionHito>
				<coordenadasHito>
					<longitud>-28.899246</longitud>
					<latitud>28.453383</latitud>
					<altitud>14.7</altitud>
				</coordenadasHito>
				<distancia>5180</distancia>
				<foto>BlackPool.png</foto>
			</hito>
			<hito nombreHito="Rock Pool">
				<descripcionHito>Lugar favorito para senderismo</descripcionHito>
				<coordenadasHito>
					<longitud>-28.9163853</longitud>
					<latitud>28.4432391</latitud>
					<altitud>16.5</altitud>
				</coordenadasHito>
				<distancia>12800</distancia>
				<foto>RockPool.png</foto>
			</hito>
		</hitos>
	</ruta>


	<ruta nombreRuta="Black Pool – Rock Pool Recorrido circular desde Ha Lehloara" > 
		<datos>
			<tipoRuta>Senderismo</tipoRuta>
			<medioTransporte>A pie</medioTransporte>
			<coordenadasRuta>
				<longitud>-28.9159641</longitud>
				<latitud>28.4234915</latitud>
				<altitud>14.5</altitud>
			</coordenadasRuta>
			<duracion>5 horas 7 minutos - 14,2 km</duracion>
			<agencia>Ninguna</agencia>
			<descripcionRuta>Caminata difícil. Se necesita muy buena forma física. Sendas de fácil acceso. Para todos los niveles.</descripcionRuta>
			<sugerencias>Llevar agua</sugerencias>
			<lugar>Hotel Maliba Lodge</lugar>
			<direccion>Hotel Maliba Lodge, Lesoto, Sudáfrica</direccion>
			<referencia>https://www.komoot.com/es-es/smarttour/19154415</referencia>
			<referencia>https://www.booking.com/Share-CsatN36</referencia>
			<referencia>https://maliba-lodge.com</referencia>
			<recomendacion>7</recomendacion>
		</datos>
		<hitos>
			<hito nombreHito="Hotel Maliba Lodge">
				<descripcionHito>Lugar favorito para senderismo</descripcionHito>
				<coordenadasHito>
					<longitud>-28.9159641</longitud>
					<latitud>28.4234915</latitud>
					<altitud>14.5</altitud>
				</coordenadasHito>
				<distancia>0</distancia>
				<foto>HotelMalibaLodge.jpg</foto>
			</hito>
			<hito nombreHito="Black Pool">
				<descripcionHito>Lugar favorito para senderismo</descripcionHito>
				<coordenadasHito>
					<longitud>-28.899246</longitud>
					<latitud>28.453383</latitud>
					<altitud>14.7</altitud>
				</coordenadasHito>
				<distancia>5180</distancia>
				<foto>BlackPool.png</foto>
			</hito>
			<hito nombreHito="Rock Pool">
				<descripcionHito>Lugar favorito para senderismo</descripcionHito>
				<coordenadasHito>
					<longitud>-28.9163853</longitud>
					<latitud>28.4432391</latitud>
					<altitud>16.5</altitud>
				</coordenadasHito>
				<distancia>12800</distancia>
				<foto>RockPool.png</foto>
			</hito>
		</hitos>
	</ruta>
</rutas>